{
  "schema_version": "2.0-rc1",
  "route": "WEEKLY_GENERATED_V2",
  "issue_id": "2026-W33",
  "research_profile": "WEEKLY",
  "publication_profile": "WEEKLY_MAGAZINE",
  "issue_metadata": {
    "title": "Japanese Generative AI Technical Survey",
    "display_date": "2026-08-14",
    "window_boundary": "Window: 2026-08-07 18:00 - 2026-08-14 18:00 America/New_York"
  },
  "visible_text": {
    "frontmatter_boundary": "Evidence / scope boundary",
    "claim_boundary": "Claim boundary",
    "summary_kicker": "WEEKLY SYNTHESIS",
    "references_title": "References / Source Notes",
    "cover_cutoff_label": "Editorial cutoff",
    "cover_repository_label": "Repository",
    "cover_build_label": "Build",
    "repository_value": "eariver/japanese-generative-ai-survey",
    "build_value": "LuaLaTeX / jlreq / LuaTeX-ja",
    "edition_descriptor": "週刊Technical Survey",
    "strapline": "一次情報・論文・OSS・X上の技術反応を分離し、検証可能なEvidence chainとして編成する"
  },
  "cover": {
    "anchors": [
      "synthetic-anchor-depth-boundary-v2-wrongrole-v2"
    ],
    "deck": "Synthetic cover deck (depth-boundary-v2-wrongrole-v2): revised MATERIAL finding carried.",
    "headline": "Synthetic cover headline (depth-boundary-v2-wrongrole-v2)"
  },
  "frontmatter": {
    "heading": "Synthetic frontmatter (depth-boundary-v2-wrongrole-v2)",
    "lede": "Synthetic lede (depth-boundary-v2-wrongrole-v2): independent reasoning on the revised graph.",
    "scope_notes": [
      "Synthetic scope note (depth-boundary-v2-wrongrole-v2)"
    ]
  },
  "closing_synthesis": "Synthetic current_interpretation for depth-boundary-v2-wrongrole-v2",
  "final_summary": {
    "heading": "Synthetic closing (depth-boundary-v2-wrongrole-v2)",
    "paragraphs": [
      "Synthetic current_interpretation for depth-boundary-v2-wrongrole-v2",
      "Synthetic supporting paragraph one (depth-boundary-v2-wrongrole-v2).",
      "Synthetic supporting paragraph two (depth-boundary-v2-wrongrole-v2)."
    ]
  },
  "packages": [
    {
      "package_id": "pkg-core",
      "section_label": "Synthetic section (depth-boundary-v2-wrongrole-v2)",
      "headline": "Synthetic headline for pkg-core (depth-boundary-v2-wrongrole-v2): revised MATERIAL finding carried",
      "deck": "Synthetic deck for pkg-core (depth-boundary-v2-wrongrole-v2): independent reasoning on the revised graph.",
      "deck_citations": [
        {
          "discovery_id": "target-source",
          "key": "w2026-W33target-source"
        }
      ],
      "blocks": [
        {
          "block_id": "pkg-core-body",
          "block_type": "PARAGRAPH",
          "text": "Synthetic body for pkg-core (depth-boundary-v2-wrongrole-v2): the revised MATERIAL claim is preserved; no HOLD promotion, no fabricated fulfilment.",
          "attribution_mode": "NONE",
          "citations": []
        },
        {
          "block_id": "pkg-core-boundaries",
          "block_type": "CLAIM_BOUNDARY",
          "text": "この節の読解上の境界: ",
          "attribution_mode": "NONE",
          "citations": []
        }
      ]
    }
  ],
  "bibliography": [
    {
      "discovery_id": "target-source",
      "key": "w2026-W33target-source",
      "title": "Synthetic verified model",
      "author": "Unknown",
      "url": "https://example.invalid/target-source",
      "urldate": "2026-10-28"
    }
  ]
}
